{
  "batch_id": "000",
  "item_count": 20,
  "review_type": "semantic",
  "items": [
    {"id": "1", "original": "Captain on the bridge!", "draft": "艦長がブリッジに！", "status": "PASS", "error_category": null, "critique": null, "final_translation": "艦長がブリッジに！", "confidence": "high", "evidence_ids": ["sub:1"], "flags": []},
    {"id": "2", "original": "Report, Chief.", "draft": "報告を　機関長", "status": "PASS", "error_category": null, "critique": null, "final_translation": "報告を　機関長", "confidence": "high", "evidence_ids": ["sub:2"], "flags": []},
    {"id": "3", "original": "We picked up a distress call, Captain. Twelve miles out.", "draft": "遭難信号を受信しました　12マイル沖です", "status": "PASS", "error_category": null, "critique": null, "final_translation": "遭難信号を受信しました　12マイル沖です", "confidence": "high", "evidence_ids": ["sub:3"], "flags": []},
    {"id": "4", "original": "Can you play it back?", "draft": "再生できるか", "status": "PASS", "error_category": null, "critique": null, "final_translation": "再生できるか", "confidence": "high", "evidence_ids": ["sub:4"], "flags": []},
    {"id": "5", "original": "...anyone... engine's flooded... we can't hold...", "draft": "…誰か…　機関室が浸水…　もう持たない…", "status": "PASS", "error_category": null, "critique": null, "final_translation": "…誰か…　機関室が浸水…　もう持たない…", "confidence": "high", "evidence_ids": ["sub:5"], "flags": []},
    {"id": "6", "original": "That's all we got, Captain.", "draft": "拾えたのはここまで", "status": "PASS", "error_category": null, "critique": null, "final_translation": "拾えたのはここまで", "confidence": "high", "evidence_ids": ["sub:6"], "flags": []},
    {"id": "7", "original": "Set course. Full ahead.", "draft": "針路を取れ　全速前進", "status": "PASS", "error_category": null, "critique": null, "final_translation": "針路を取れ　全速前進", "confidence": "high", "evidence_ids": ["sub:7"], "flags": []},
    {"id": "8", "original": "Steady as she goes, ma'am.", "draft": "ようそろ", "status": "PASS", "error_category": null, "critique": null, "final_translation": "ようそろ", "confidence": "high", "evidence_ids": ["sub:8"], "flags": []},
    {"id": "9", "original": "Ensign Cole, I need you on the forward deck.", "draft": "コール少尉　前甲板へ", "status": "PASS", "error_category": null, "critique": null, "final_translation": "コール少尉　前甲板へ", "confidence": "high", "evidence_ids": ["sub:9"], "flags": []},
    {"id": "10", "original": "Aye, Captain.", "draft": "了解しました", "status": "PASS", "error_category": null, "critique": null, "final_translation": "了解しました", "confidence": "high", "evidence_ids": ["sub:10"], "flags": []},
    {"id": "11", "original": "Morgan, keep hailing them on channel sixteen.", "draft": "モーガン　16チャンネルで呼びかけを続けろ", "status": "PASS", "error_category": null, "critique": null, "final_translation": "モーガン　16チャンネルで呼びかけを続けろ", "confidence": "high", "evidence_ids": ["sub:11"], "flags": []},
    {"id": "12", "original": "Already on it.", "draft": "もうやってるわよ", "status": "PASS", "error_category": null, "critique": null, "final_translation": "もうやってるわよ", "confidence": "high", "evidence_ids": ["sub:12"], "flags": ["voice_issue"]},
    {"id": "13", "original": "Oh, great. A storm front. Just what we needed.", "draft": "ああ　素晴らしい　前線だ　まさに必要なものだった", "status": "FIXED", "error_category": "irony", "critique": "原文は接近する嵐への皮肉（不満）だが、draft は字義通りで賞賛・待望に読める。反語として意図を再現した", "final_translation": "最高だね　前線か　ついてるよ", "confidence": "high", "evidence_ids": ["sub:13", "sub:14-16"], "flags": []},
    {"id": "14", "original": "If we cannot reach them before that front closes in,", "draft": "前線に追いつかれる前に到着できなければ", "status": "PASS", "error_category": null, "critique": null, "final_translation": "前線に追いつかれる前に到着できなければ", "confidence": "high", "evidence_ids": ["sub:14-16"], "flags": []},
    {"id": "15", "original": "every soul on that boat, and I mean every soul,", "draft": "あの船の全員が　ええ　一人残らずです", "status": "PASS", "error_category": null, "critique": null, "final_translation": "あの船の全員が　ええ　一人残らずです", "confidence": "high", "evidence_ids": ["sub:14-16"], "flags": []},
    {"id": "16", "original": "will be in the water by dawn.", "draft": "夜明けには海に投げ出されます", "status": "PASS", "error_category": null, "critique": null, "final_translation": "夜明けには海に投げ出されます", "confidence": "high", "evidence_ids": ["sub:14-16"], "flags": []},
    {"id": "17", "original": "Then we reach them first.", "draft": "なら先に着くまでだ", "status": "PASS", "error_category": null, "critique": null, "final_translation": "なら先に着くまでだ", "confidence": "high", "evidence_ids": ["sub:17"], "flags": []},
    {"id": "18", "original": "Danny, you okay? You look pale.", "draft": "ダニー　大丈夫？　顔色悪いよ", "status": "PASS", "error_category": null, "critique": null, "final_translation": "ダニー　大丈夫？　顔色悪いよ", "confidence": "high", "evidence_ids": ["sub:18"], "flags": []},
    {"id": "19", "original": "I told you I'd be fine. Worry about yourself.", "draft": "大丈夫だと言っただろ　お前こそ心配しろ", "status": "PASS", "error_category": null, "critique": null, "final_translation": "大丈夫だと言っただろ　お前こそ心配しろ", "confidence": "high", "evidence_ids": ["sub:18", "sub:19"], "flags": []},
    {"id": "20", "original": "Chief, you were right about the engine room.", "draft": "機関長　機関室の件は君が正しかった", "status": "PASS", "error_category": null, "critique": null, "final_translation": "機関長　機関室の件は君が正しかった", "confidence": "high", "evidence_ids": ["sub:20"], "flags": []}
  ]
}
